user,soup
user 1,"data science for beginners what is data science data science in 5 minutes what is data science for beginners data science tutorial data science applications introduction to data science data science with python who is a data scientist data scientist day in the life what does data scientist do a day in the life of a data scientist data science explained learn data science data science tutorial for beginners data science simplilearn data science simplilearn t h i s   d a t a   s c i e n c e   t u t o r i a l   v i d e o   w i l l   g i v e   y o u   a n   i d e a   o n   t h e   l i f e   o f   a   d a t a   s c i e n t i s t ,   s t e p s   i n v o l v e d   i n   d a t a   s c i e n c e   p r o j e c t ,   r o l e s   &   s a l a r y   o f f e r e d   t o   a   d a t a   s c i e n t i s t .   d a t a   i s   e v e r y w h e r e .   i n   f a c t ,   t h e   a m o u n t   o f   d i g i t a l   d a t a   t h a t   e x i s t s   i s   g r o w i n g   a t   a   r a p i d   r a t e ,   d o u b l i n g   e v e r y   t w o   y e a r s ,   a n d   c h a n g i n g   t h e   w a y   w e   l i v e .   d a t a   s c i e n c e   i s   b a s i c a l l y   d e a l i n g   w i t h   u n s t r u c t u r e d   a n d   s t r u c t u r e d   d a t a .   d a t a   s c i e n c e   i s   a   f i e l d   t h a t   c o m p r i s e s   o f   e v e r y t h i n g   t h a t   i s   r e l a t e d   t o   d a t a   c l e a n s i n g ,   p r e p a r a t i o n ,   a n d   a n a l y s i s .   i n   s i m p l e   t e r m s ,   i t   i s   t h e   u m b r e l l a   o f   t e c h n i q u e s   u s e d   w h e n   t r y i n g   t o   e x t r a c t   i n s i g h t s   a n d   i n f o r m a t i o n   f r o m   d a t a .   n o w ,   l e t   u s   g e t   s t a r t e d   a n d   u n d e r s t a n d   w h a t   i s   d a t a   s c i e n c e   a l l   a b o u t . 
 
 b e l o w   t o p i c s   a r e   e x p l a i n e d   i n   t h i s   d a t a   s c i e n c e   t u t o r i a l : 
 1 .   l i f e   o f   a   d a t a   s c i e n t i s t 
 2 .   s t e p s   i n   d a t a   s c i e n c e   p r o j e c t 
   -   u n d e r s t a n d i n g   t h e   b u s i n e s s   p r o b l e m 
   -   d a t a   a c q u i s i t i o n 
   -   d a t a   p r e p a r a t i o n 
   -   e x p l o r a t o r y   d a t a   a n a l y s i s 
   -   d a t a   m o d e l i n g 
   -   v i s u a l i z a t i o n   a n d   c o m m u n i c a t i o n 
   -   d e p l o y   &   m a i n t e n a n c e 
 3 .   r o l e s   o f f e r e d   t o   a   d a t a   s c i e n t i s t 
 4 .   s a l a r y   o f   a   d a t a   s c i e n t i s t 
 
 t o   l e a r n   m o r e   a b o u t   d a t a   s c i e n c e ,   s u b s c r i b e   t o   o u r   y o u t u b e   c h a n n e l :   
 
 r e a d   t h e   f u l l   a r t i c l e   h e r e :   
 
 w a t c h   m o r e   v i d e o s   o n   d a t a   s c i e n c e :   
 
             
 
 t h i s   d a t a   s c i e n c e   w i t h   p y t h o n   c o u r s e   w i l l   e s t a b l i s h   y o u r   m a s t e r y   o f   d a t a   s c i e n c e   a n d   a n a l y t i c s   t e c h n i q u e s   u s i n g   p y t h o n .   w i t h   t h i s   p y t h o n   f o r   d a t a   s c i e n c e   c o u r s e ,   y o u ’ l l   l e a r n   t h e   e s s e n t i a l   c o n c e p t s   o f   p y t h o n   p r o g r a m m i n g   a n d   b e c o m e   a n   e x p e r t   i n   d a t a   a n a l y t i c s ,   m a c h i n e   l e a r n i n g ,   d a t a   v i s u a l i z a t i o n ,   w e b   s c r a p i n g   a n d   n a t u r a l   l a n g u a g e   p r o c e s s i n g .   p y t h o n   i s   a   r e q u i r e d   s k i l l   f o r   m a n y   d a t a   s c i e n c e   p o s i t i o n s ,   s o   j u m p s t a r t   y o u r   c a r e e r   w i t h   t h i s   i n t e r a c t i v e ,   h a n d s - o n   c o u r s e . 
 
 w h y   l e a r n   d a t a   s c i e n c e ?   
 d a t a   s c i e n t i s t s   a r e   b e i n g   d e p l o y e d   i n   a l l   k i n d s   o f   i n d u s t r i e s ,   c r e a t i n g   a   h u g e   d e m a n d   f o r   s k i l l e d   p r o f e s s i o n a l s .   d a t a   s c i e n t i s t   i s   t h e   p i n n a c l e   r a n k   i n   a n   a n a l y t i c s   o r g a n i z a t i o n .   g l a s s d o o r   h a s   r a n k e d   d a t a   s c i e n t i s t   f i r s t   i n   t h e   2 5   b e s t   j o b s   f o r   2 0 1 6 ,   a n d   g o o d   d a t a   s c i e n t i s t s   a r e   s c a r c e   a n d   i n   g r e a t   d e m a n d .   a s   a   d a t a   y o u   w i l l   b e   r e q u i r e d   t o   u n d e r s t a n d   t h e   b u s i n e s s   p r o b l e m ,   d e s i g n   t h e   a n a l y s i s ,   c o l l e c t   a n d   f o r m a t   t h e   r e q u i r e d   d a t a ,   a p p l y   a l g o r i t h m s   o r   t e c h n i q u e s   u s i n g   t h e   c o r r e c t   t o o l s ,   a n d   f i n a l l y   m a k e   r e c o m m e n d a t i o n s   b a c k e d   b y   d a t a . 
 
 y o u   c a n   g a i n   i n - d e p t h   k n o w l e d g e   o f   d a t a   s c i e n c e   b y   t a k i n g   o u r   d a t a   s c i e n c e   w i t h   p y t h o n   c e r t i f i c a t i o n   t r a i n i n g   c o u r s e .   w i t h   s i m p l i l e a r n ’ s   d a t a   s c i e n c e   c e r t i f i c a t i o n   t r a i n i n g   c o u r s e ,   y o u   w i l l   p r e p a r e   f o r   a   c a r e e r   a s   a   d a t a   s c i e n t i s t   a s   y o u   m a s t e r   a l l   t h e   c o n c e p t s   a n d   t e c h n i q u e s .   t h o s e   w h o   c o m p l e t e   t h e   c o u r s e   w i l l   b e   a b l e   t o :   
 
 1 .   g a i n   a n   i n - d e p t h   u n d e r s t a n d i n g   o f   d a t a   s c i e n c e   p r o c e s s e s ,   d a t a   w r a n g l i n g ,   d a t a   e x p l o r a t i o n ,   d a t a   v i s u a l i z a t i o n ,   h y p o t h e s i s   b u i l d i n g ,   a n d   t e s t i n g .   y o u   w i l l   a l s o   l e a r n   t h e   b a s i c s   o f   s t a t i s t i c s . 
 i n s t a l l   t h e   r e q u i r e d   p y t h o n   e n v i r o n m e n t   a n d   o t h e r   a u x i l i a r y   t o o l s   a n d   l i b r a r i e s 
 2 .   u n d e r s t a n d   t h e   e s s e n t i a l   c o n c e p t s   o f   p y t h o n   p r o g r a m m i n g   s u c h   a s   d a t a   t y p e s ,   t u p l e s ,   l i s t s ,   d i c t s ,   b a s i c   o p e r a t o r s   a n d   f u n c t i o n s 
 3 .   p e r f o r m   h i g h - l e v e l   m a t h e m a t i c a l   c o m p u t i n g   u s i n g   t h e   n u m p y   p a c k a g e   a n d   i t s   l a r g e   l i b r a r y   o f   m a t h e m a t i c a l   f u n c t i o n s 
 p e r f o r m   s c i e n t i f i c   a n d   t e c h n i c a l   c o m p u t i n g   u s i n g   t h e   s c i p y   p a c k a g e   a n d   i t s   s u b - p a c k a g e s   s u c h   a s   i n t e g r a t e ,   o p t i m i z e ,   s t a t i s t i c s ,   i o   a n d   w e a v e 
 4 .   p e r f o r m   d a t a   a n a l y s i s   a n d   m a n i p u l a t i o n   u s i n g   d a t a   s t r u c t u r e s   a n d   t o o l s   p r o v i d e d   i n   t h e   p a n d a s   p a c k a g e 
 5 .   g a i n   e x p e r t i s e   i n   m a c h i n e   l e a r n i n g   u s i n g   t h e   s c i k i t - l e a r n   p a c k a g e 
 
 t h e   d a t a   s c i e n c e   w i t h   p y t h o n   i s   r e c o m m e n d e d   f o r :   
 1 .   a n a l y t i c s   p r o f e s s i o n a l s   w h o   w a n t   t o   w o r k   w i t h   p y t h o n 
 2 .   s o f t w a r e   p r o f e s s i o n a l s   l o o k i n g   t o   g e t   i n t o   t h e   f i e l d   o f   a n a l y t i c s 
 3 .   i t   p r o f e s s i o n a l s   i n t e r e s t e d   i n   p u r s u i n g   a   c a r e e r   i n   a n a l y t i c s 
 4 .   g r a d u a t e s   l o o k i n g   t o   b u i l d   a   c a r e e r   i n   a n a l y t i c s   a n d   d a t a   s c i e n c e 
 5 .   e x p e r i e n c e d   p r o f e s s i o n a l s   w h o   w o u l d   l i k e   t o   h a r n e s s   d a t a   s c i e n c e   i n   t h e i r   f i e l d s 
 
 l e a r n   m o r e   a t :   
 
 f o r   m o r e   i n f o r m a t i o n   a b o u t   s i m p l i l e a r n ’ s   c o u r s e s ,   v i s i t :   
 -   f a c e b o o k :     
 -   t w i t t e r :     
 -   l i n k e d i n :   . . .   
 -   w e b s i t e :     
 
 g e t   t h e   a n d r o i d   a p p :     
 g e t   t h e   i o s   a p p :           d a t a   s c i e n c e   i n   5   m i n u t e s   |   d a t a   s c i e n c e   f o r   b e g i n n e r s   |   w h a t   i s   d a t a   s c i e n c e ?   |   s i m p l i l e a r ndata science python data science with python python for data science python data science learn python for data science python data science tutorial python data learn python for data science online free data science with python tutorial learn python for data science from scratch learn python for data science online data science tutorial data science for beginners python data analysis w e l c o m e   t o   t h e   1 s t   e p i s o d e   o f   l e a r n   p y t h o n   f o r   d a t a   s c i e n c e !   t h i s   s e r i e s   w i l l   t e a c h   y o u   p y t h o n   a n d   d a t a   s c i e n c e   a t   t h e   s a m e   t i m e !   i n   t h i s   v i d e o   w e   i n s t a l l   p y t h o n   a n d   o u r   t e x t   e d i t o r   ( s u b l i m e   t e x t ) ,   t h e n   b u i l d   a   g e n d e r   c l a s s i f i e r   u s i n g   t h e   s c i - k i t   l e a r n   l i b r a r y   i n   j u s t   a b o u t   1 0   l i n e s   o f   c o d e . 
 
 p l e a s e   s u b s c r i b e   &   s h a r e   t h i s   v i d e o   i f   y o u   l i k e d   i t ! 
 
 t h e   c o d e   f o r   t h i s   v i d e o   i s   h e r e : 
 
 
 i   c r e a t e d   a   s l a c k   c h a n n e l   f o r   u s ,   s i g n   u p   h e r e : 
 
 
 d o w n l o a d   p y t h o n   h e r e : 
 
 
 d o w n l o a d   s u b l i m e   t e x t   h e r e : 
 
 
 s o m e   g r e a t   s i m p l e   s c i - k i t   l e a r n   e x a m p l e s   h e r e : 
 
 
 a n d   t h e   o f f i c i a l   s c i k i t   w e b s i t e : 
 
 
 h i g h l y   r e c o m m e n d   t h i s   o n l i n e   b o o k   a s   s u p p l e m e n t a r y   r e a d i n g   m a t e r i a l : 
 
 
 w o n d e r i n g   w h e n   t o   u s e   w h i c h   m o d e l ?   t h i s   c h a r t   h e l p s ,   b u t   k e e p   i n   m i n d   d e e p   n e u r a l   n e t s   o u t p e r f o r m   p r e t t y   m u c h   a n y   m o d e l   g i v e n   e n o u g h   d a t a   a n d   c o m p u t i n g   p o w e r .   s o   u s e   t h e s e   w h e n   y o u   d o n ' t   h a v e   a c c e s s   t o   l o a d s   o f   d a t a   a n d   c o m p u t e : 
 
 
 t h a n k   y o u   g u y s   f o r   w a t c h i n g !   s u b s c r i b e ,   l i k e ,   a n d   c o m m e n t !   t h a t ' s   w h a t   k e e p s   m e   g o i n g .   f e e l   f r e e   t o   s u p p o r t   m e   o n   p a t r e o n : 
 
 
 f o l l o w   m e : 
 t w i t t e r :   
 f a c e b o o k :     i n s t a g r a m :     i n s t a g r a m :     
 s i g n u p   f o r   m y   n e w s l e t t e r   f o r   e x c i t i n g   u p d a t e s   i n   t h e   f i e l d   o f   a i : 
 
 h i t   t h e   j o i n   b u t t o n   a b o v e   t o   s i g n   u p   t o   b e c o m e   a   m e m b e r   o f   m y   c h a n n e l   f o r   a c c e s s   t o   e x c l u s i v e   c o n t e n t !         i n t r o d u c t i o n   -   l e a r n   p y t h o n   f o r   d a t a   s c i e n c e   # 1super mario world machine learning neural network genetic algorithm sethbling neuro evolution neat mari/o m a r i / o   i s   a   p r o g r a m   m a d e   o f   n e u r a l   n e t w o r k s   a n d   g e n e t i c   a l g o r i t h m s   t h a t   k i c k s   b u t t   a t   s u p e r   m a r i o   w o r l d . 
 s o u r c e   c o d e :   h t t p : / / p a s t e b i n . c o m / z z m s n a h x 
 "" n e a t ""   p a p e r :   
 s o m e   r e l e v a n t   w i k i p e d i a   l i n k s : 
 
 
 
 b i z h a w k   e m u l a t o r :   
 
 s e t h b l i n g   t w i t t e r :   
 s e t h b l i n g   t w i t c h :   
 s e t h b l i n g   f a c e b o o k :   
 s e t h b l i n g   w e b s i t e :   
 s e t h b l i n g   s h i r t s :   
 s u g g e s t   i d e a s :   
 
 m u s i c   a t   t h e   e n d   i s   c i p h e r   b y   k e v i n   m a c l e o d         m a r i / o   -   m a c h i n e   l e a r n i n g   f o r   v i d e o   g a m e sengineering online degree data scientist machine learning deep learning big data how to become a data scientist data science with python data science tutorial data science career s k i l l s h a r e   m i g h t   n o t   l i k e   t h i s .   y o u   c a n   s i g n   u p   f o r   a   2   m o n t h   t r i a l   f o r   s k i l l s h a r e ,   c o m p l e t e   t h e   d a t a   s c i e n c e   c o u r s e   a n d   t h e n   c a n c e l   y o u r   m e m b e r s h i p   b e f o r e   b e i n g   c h a r g e d : 
 h t t p : / / e n g i n e e r e d t r u t h . c o m / s k i l l s h a r e . . . 
 
 s k i l l s h a r e   i s   t h e   n e t f l i x   o f   o n l i n e   c o u r s e s .   s u b s c r i b e   f o r   j u s t   $ 1 5   p e r   m o n t h   t o   g e t   a c c e s s   t o   o v e r   1 8 , 0 0 0 +   c o u r s e s   ( s o m e   b e t t e r   t h a n   o t h e r s ) 
 
 c h e c k   o u t   j o m a ' s   y o u t u b e   c h a n n e l   h e r e : 
 
 
 t h e   s k i l l s h a r e   l i n k   i s   a n   a f f i l i a t e   l i n k         d a t a   s c i e n c e :   r e a l i t y   v s   e x p e c t a t i o n s   ( $ 1 0 0 k +   s t a r t i n g   s a l a r y   2 0 1 8 )data science data science interview data science interview questions data science interview questions and answers data scientist tutorial data scientist training analytics interview questions data science interviews exposed data scientist interview data scientist interview questions data scientist interview exposed data science course data science career path data science for beginners data science siraj raval career siraj raval machine learning d a t a   s c i e n c e   i s   b e c o m i n g   m o r e   a n d   m o r e   p o p u l a r   a s   a   c a r e e r   c h o i c e   s i n c e   i t   o f f e r s   b o t h   l u c r a t i v e   s a l a r i e s   a n d   t h e   o p p o r t u n i t y   t o   h a v e   h i g h   i m p a c t .   t h e   d a t a   s c i e n c e   i n t e r v i e w   p r o c e s s   i s   c h a l l e n g i n g ,   b u t   w i t h   d e d i c a t e d   p r a c t i c e   y o u   c a n   s u c c e e d .   i n   t h i s   v i d e o ,   i ' l l   o u t l i n e   t h e   7   s t e p s   t o   p a s s   a n y   d a t a   s c i e n c e   i n t e r v i e w .   w e ' l l   g o   o v e r   t o p i c s   l i k e   s t u d y i n g   t e c h n i q u e s ,   p o r t f o l i o   o p t i m i z a t i o n ,   a n d   i n t e r v i e w i n g   t i p s ,   a l l   o f   w h i c h   a r e   p r o m i n e n t   i n   t h e   m o d e r n   d a t a   s c i e n c e   i n t e r v i e w   p i p e l i n e .   i ' v e   l i s t e d   a l l   o f   t h e   r e s o u r c e s   i ' v e   m e n t i o n e d   b o t h   i n   t h e   v i d e o   d e s c r i p t i o n   a n d   i n   t h e   a s s o c i a t e d   g i t h u b   r e a d m e .   e n j o y ! 
 
 p l a n   f o r   t h i s   v i d e o : 
 
 
 p l e a s e   s u b s c r i b e !   a n d   l i k e .   a n d   c o m m e n t .   t h a t s   w h a t   k e e p s   m e   g o i n g . 
 
 w a n t   m o r e   e d u c a t i o n ?   c o n n e c t   w i t h   m e   h e r e : 
 t w i t t e r :   
 i n s t a g r a m :   
 f a c e b o o k :   
 
 s t e p   1   -   a s k   y o u r s e l f   "" w h y "" 
 
 i n v e s t o r   i n s i g h t s   f o r   i n s p i r a t i o n 
 
 
 i n v e s t o r s   t o   f o l l o w   o n   t w i t t e r 
 
 
 d a t a   s t o r i e s   p o d c a s t s 
 
 
 s t e p   2   -   c r e a t e   a n d   e x e c u t e   a   s t u d y   p l a n 
 
 l e a r n   d a t a   s c i e n c e   i n   3   m o n t h s 
 
 
 c h r o m e b o o k   d a t a   s c i e n c e 
 
 
 o p e n   s o u r c e   u n i v e r s i t y   
 
 
 p r a c t i c e   t e c h n i c a l   i n t e r v i e w s 
 
 
 u s e   f l a s h c a r d s 
 
 
 f i n d   a   m e n t o r 
 
 
 s t e p   3   -   b u i l d   a   p o r t f o l i o 
 
 d e s i g n   a   r e s u m e   +   p e r s o n a l   w e b s i t e 
 
 
 a n d   h a v e   3   p r o j e c t s   o n   g i t h u b ,   o n e   s h o u l d   h a v e   a   w e b   p r e s e n c e 
 
 s t e p   4   -   s t a r t   p i t c h i n g   f o r   j o b s 
 
 -   
 -   a s k   f r i e n d s   o n   s o c i a l   m e d i a 
 -     ( v c   p o r t f o l i o   c o m p a n i e s   j o b   l i s t i n g s ) 
 -   
 -   f i n d   r e c r u i t e r s   u s i n g   
 "" s i t e : l i n k e d i n . c o m   q u o r a   t e c h n i c a l   r e c r u i t e r ""   
 b u t   r e p l a c e   q u o r a   w i t h   y o u r   c o m p a n y 
 
 s c h e d u l i n g   t o o l 
 
 
 s t e p   5   -   c o m p l e t e   t h e   i n t e r v i e w 
 
 s t u d y   d a t a   s c i e n c e   i n t e r v i e w   q u e s t i o n s   o n   g l a s s d o o r 
   
 
 - - - - - - - - - - - - - - - - 
 
 j o i n   u s   a t   t h e   s c h o o l   o f   a i : 
 
 
 j o i n   u s   i n   t h e   w i z a r d s   s l a c k   c h a n n e l : 
 
 
 p l e a s e   s u p p o r t   m e   o n   p a t r e o n : 
 
 
 s i g n u p   f o r   m y   n e w s l e t t e r   f o r   e x c i t i n g   u p d a t e s   i n   t h e   f i e l d   o f   a i : 
   
 
     
 h i t   t h e   j o i n   b u t t o n   a b o v e   t o   s i g n   u p   t o   b e c o m e   a   m e m b e r   o f   m y   c h a n n e l   f o r   a c c e s s   t o   e x c l u s i v e   c o n t e n t !         5   s t e p s   t o   p a s s   d a t a   s c i e n c e   i n t e r v i e w sprogramming computers code hacking information security ios iphone udemy online-courses coupons free-coupons udemy-coupons udemy-courses android iphone reactjs web-development machine learning machine tensorflow scikit data mining h t t p : / / w w w . l e a r n c o d e o n l i n e . i n 
 m a c h i n e   l e a r n i n g   i s   j u s t   t o   g i v e   t r a i n e d   d a t a   t o   a   p r o g r a m   a n d   g e t   b e t t e r   r e s u l t   f o r   c o m p l e x   p r o b l e m s .   i t   i s   v e r y   c l o s e   t o   d a t a   m i n i n g .   
 w h i l e   m a n y   m a c h i n e   l e a r n i n g   a l g o r i t h m s   h a v e   b e e n   a r o u n d   f o r   a   l o n g   t i m e ,   t h e   a b i l i t y   t o   a u t o m a t i c a l l y   a p p l y   c o m p l e x   m a t h e m a t i c a l   c a l c u l a t i o n s   t o   b i g   d a t a   –   o v e r   a n d   o v e r ,   f a s t e r   a n d   f a s t e r   –   i s   a   r e c e n t   d e v e l o p m e n t .   h e r e   a r e   a   f e w   w i d e l y   p u b l i c i z e d   e x a m p l e s   o f   m a c h i n e   l e a r n i n g   a p p l i c a t i o n s   y o u   m a y   b e   f a m i l i a r   w i t h : 
 
 t h e   h e a v i l y   h y p e d ,   s e l f - d r i v i n g   g o o g l e   c a r ?   t h e   e s s e n c e   o f   m a c h i n e   l e a r n i n g . 
 o n l i n e   r e c o m m e n d a t i o n   o f f e r s   s u c h   a s   t h o s e   f r o m   a m a z o n   a n d   n e t f l i x ?   m a c h i n e   l e a r n i n g   a p p l i c a t i o n s   f o r   e v e r y d a y   l i f e . 
 k n o w i n g   w h a t   c u s t o m e r s   a r e   s a y i n g   a b o u t   y o u   o n   t w i t t e r ?   m a c h i n e   l e a r n i n g   c o m b i n e d   w i t h   l i n g u i s t i c   r u l e   c r e a t i o n . 
 f r a u d   d e t e c t i o n ?   o n e   o f   t h e   m o r e   o b v i o u s ,   i m p o r t a n t   u s e s   i n   o u r   w o r l d   t o d a y . 
 
 
 f b :   
 h o m e p a g e :           w h a t   i s   m a c h i n e   l e a r n i n g   a n d   h o w   t o   l e a r n   i t   ?science math engineering computer technology robotics reinforcement supervised learning algorithm machine image processing ica theory programming code l e c t u r e   b y   p r o f e s s o r   a n d r e w   n g   f o r   m a c h i n e   l e a r n i n g   ( c s   2 2 9 )   i n   t h e   s t a n f o r d   c o m p u t e r   s c i e n c e   d e p a r t m e n t .     p r o f e s s o r   n g   p r o v i d e s   a n   o v e r v i e w   o f   t h e   c o u r s e   i n   t h i s   i n t r o d u c t o r y   m e e t i n g .   
 
 t h i s   c o u r s e   p r o v i d e s   a   b r o a d   i n t r o d u c t i o n   t o   m a c h i n e   l e a r n i n g   a n d   s t a t i s t i c a l   p a t t e r n   r e c o g n i t i o n .   t o p i c s   i n c l u d e   s u p e r v i s e d   l e a r n i n g ,   u n s u p e r v i s e d   l e a r n i n g ,   l e a r n i n g   t h e o r y ,   r e i n f o r c e m e n t   l e a r n i n g   a n d   a d a p t i v e   c o n t r o l .       r e c e n t   a p p l i c a t i o n s   o f   m a c h i n e   l e a r n i n g ,   s u c h   a s   t o   r o b o t i c   c o n t r o l ,   d a t a   m i n i n g ,   a u t o n o m o u s   n a v i g a t i o n ,   b i o i n f o r m a t i c s ,   s p e e c h   r e c o g n i t i o n ,   a n d   t e x t   a n d   w e b   d a t a   p r o c e s s i n g   a r e   a l s o   d i s c u s s e d . 
 
 c o m p l e t e   p l a y l i s t   f o r   t h e   c o u r s e : 
 
 
 c s   2 2 9   c o u r s e   w e b s i t e : 
 
 
 s t a n f o r d   u n i v e r s i t y : 
 
 
 s t a n f o r d   u n i v e r s i t y   c h a n n e l   o n   y o u t u b e :         l e c t u r e   1   |   m a c h i n e   l e a r n i n g   ( s t a n f o r d )data science data analysis data science careers data scientist data analytics data science course t a k e   y o u r   f i r s t   s t e p   t o   b e c o m i n g   a   d a t a   s c i e n t i s t   ( $ 1 2 0 k   a v g .   s a l a r y ) :   h t t p : / / e n g i n e e r e d t r u t h . c o m / s k i l l s h a r e . . . 
 
 i   a m   a n   a f f i l i a t e   f o r   s k i l l s h a r e ,   a n d   g e t   $ 1 0   p e r   t r i a l   s i g n - u p . 
 
 j o i n   t h e   c o n v e r s a t i o n   i n   t h e   e n g i n e e r e d   t r u t h   f b   g r o u p :   
 
 e n g i n e e r e d   t r u t h   a p p a r e l : 
 
 
 s o c i a l   m e d i a :         h o w   t o   b e c o m e   a   d a t a   s c i e n t i s t   ( y o u   d o n ' t   n e e d   c o l l e g e )how to become a data scientist how to become a data scientist in 6 months career in data science data science future data science roadmap data scientist skills data scientist salary data science upgrad upgrad courses upgrad app data science training data science upgrad data science upgrad course data science certification skills of data scientist data scientist skill set l e v e r a g i n g   t h e   u s e   o f   b i g   d a t a ,   a s   a n   i n s i g h t - g e n e r a t i n g   e n g i n e   h a s   d r i v e n   t h e   d e m a n d   f o r   d a t a   s c i e n t i s t s   a t   e n t e r p r i s e - l e v e l ,   a c r o s s   a l l   i n d u s t r y   v e r t i c a l s .   w h e t h e r   i t   i s   t o   r e f i n e   t h e   p r o c e s s   o f   p r o d u c t   d e v e l o p m e n t ,   i m p r o v e   c u s t o m e r   r e t e n t i o n ,   o r   m i n e   t h r o u g h   t h e   d a t a   t o   f i n d   n e w   b u s i n e s s   o p p o r t u n i t i e s   -   o r g a n i z a t i o n s   a r e   i n c r e a s i n g l y   r e l y i n g   o n   t h e   e x p e r t i s e   o f   d a t a   s c i e n t i s t s   t o   s u s t a i n ,   g r o w ,   a n d   o u t d o   t h e i r   c o m p e t i t i o n .   a s   t h e   d e m a n d   f o r   d a t a   s c i e n t i s t s   i n c r e a s e s ,   t h e   d i s c i p l i n e   p r e s e n t s   a n   e n t i c i n g   c a r e e r   p a t h   f o r   s t u d e n t s   a n d   e x i s t i n g   p r o f e s s i o n a l s . 
 
 r a h i m   b a i g   -   l e a d   b u s i n e s s   a n a l y s t   a t   f l i p k a r t ,   e x p l a i n i n g   t h e   t o p   s k i l l s   t o   b e c o m e   a   s u c c e s s f u l   .   t h e s e     w i l l   h e l p   y o u   b e c o m i n g   a   s u c c e s s f u l   d a t a   s c i e n t i s t . 
 
 w a t c h   t h i s   v i d e o   t o   l e a r n   h o w   t o   b e c o m e   a   d a t a   s c i e n t i s t . 
 
 
 
 w a t c h   m o r e   v i d e o s   i n   t h i s   s e r i e s :   
 
 
 k n o w   m o r e   a b o u t   u p g r a d   &   i i i t   b a n g a l o r e   p g   p r o g r a m   i n   d a t a   s c i e n c e :   
 
 o p e n   t h e   d o o r s   f o r   y o u r   c a r e e r   t h r o u g h   u p g r a d .   e x p e r i e n c e   a   n e w   w a y   o f   l e a r n i n g   o n l i n e   w i t h   d e d i c a t e d   m e n t o r s h i p ,   i n d u s t r y   e x p o s u r e   a n d   e x p e r t   c a r e e r   a s s i s t a n c e .   
 
 u p g r a d   i s   a n   o n l i n e   h i g h e r   e d u c a t i o n   p l a t f o r m   p r o v i d i n g   r i g o r o u s   i n d u s t r y - r e l e v a n t   p r o g r a m s   d e s i g n e d   a n d   d e l i v e r e d   i n   c o l l a b o r a t i o n   w i t h   w o r l d - c l a s s   f a c u l t y   a n d   i n d u s t r y .   m e r g i n g   t h e   l a t e s t   t e c h n o l o g y ,   p e d a g o g y ,   a n d   s e r v i c e s ,   u p g r a d   i s   c r e a t i n g   a n   i m m e r s i v e   l e a r n i n g   e x p e r i e n c e   –   a n y t i m e   a n d   a n y w h e r e .   u p g r a d   b e g a n   i n   2 0 1 5   w i t h   t h e   c o n v i c t i o n   t h a t   i n   a n   e v e r - c h a n g i n g   i n d u s t r y ,   p r o f e s s i o n a l s   n e e d   t o   c o n t i n u o u s l y   u p s k i l l   t h e m s e l v e s   i n   o r d e r   t o   s t a y   r e l e v a n t . 
 
 u p g r a d   h a s   c r e a t e d   s o m e   o f   i n d i a ’ s   l a r g e s t   o n l i n e   p r o g r a m s   t o   h e l p   t h o u s a n d s   o f   p r o f e s s i o n a l s   a c h i e v e   t h e i r   c a r e e r   g o a l s   i n   t h e   a r e a s   o f   d a t a ,   t e c h n o l o g y ,   a n d   m a n a g e m e n t . 
 
 s t a y   o n   t o p   o f   y o u r   i n d u s t r y   b y   i n t e r a c t i n g   w i t h   u s   o n   o u r   s o c i a l   c h a n n e l s : 
 f o l l o w   u s   o n   i n s t a g r a m :   
 l i k e   u s   o n   f a c e b o o k :   
 f o l l o w   u s   o n   t w i t t e r :   
 f o l l o w   u s   o n   l i n k e d i n :           d a t a   s c i e n c e   s k i l l s   |   s k i l l s e t   r e q u i r e d   t o   b e c o m e   a   d a t a   s c i e n t i s t   |   c a r e e r s   i n   s h o r t s   |   u p g r a dhow to become a data scientist how to become a data scientist in 6 months career in data science data science future data science roadmap data scientist skills data scientist salary data science upgrad upgrad courses upgrad app data science training data science upgrad data science upgrad course data science certification skills of data scientist data scientist skill set l e v e r a g i n g   t h e   u s e   o f   b i g   d a t a ,   a s   a n   i n s i g h t - g e n e r a t i n g   e n g i n e   h a s   d r i v e n   t h e   d e m a n d   f o r   d a t a   s c i e n t i s t s   a t   e n t e r p r i s e - l e v e l ,   a c r o s s   a l l   i n d u s t r y   v e r t i c a l s .   w h e t h e r   i t   i s   t o   r e f i n e   t h e   p r o c e s s   o f   p r o d u c t   d e v e l o p m e n t ,   i m p r o v e   c u s t o m e r   r e t e n t i o n ,   o r   m i n e   t h r o u g h   t h e   d a t a   t o   f i n d   n e w   b u s i n e s s   o p p o r t u n i t i e s   -   o r g a n i z a t i o n s   a r e   i n c r e a s i n g l y   r e l y i n g   o n   t h e   e x p e r t i s e   o f   d a t a   s c i e n t i s t s   t o   s u s t a i n ,   g r o w ,   a n d   o u t d o   t h e i r   c o m p e t i t i o n .   a s   t h e   d e m a n d   f o r   d a t a   s c i e n t i s t s   i n c r e a s e s ,   t h e   d i s c i p l i n e   p r e s e n t s   a n   e n t i c i n g   c a r e e r   p a t h   f o r   s t u d e n t s   a n d   e x i s t i n g   p r o f e s s i o n a l s . 
 
 r a h i m   b a i g   -   l e a d   b u s i n e s s   a n a l y s t   a t   f l i p k a r t ,   e x p l a i n i n g   t h e   t o p   s k i l l s   t o   b e c o m e   a   s u c c e s s f u l   .   t h e s e     w i l l   h e l p   y o u   b e c o m i n g   a   s u c c e s s f u l   d a t a   s c i e n t i s t . 
 
 w a t c h   t h i s   v i d e o   t o   l e a r n   h o w   t o   b e c o m e   a   d a t a   s c i e n t i s t . 
 
 
 
 w a t c h   m o r e   v i d e o s   i n   t h i s   s e r i e s :   
 
 
 k n o w   m o r e   a b o u t   u p g r a d   &   i i i t   b a n g a l o r e   p g   p r o g r a m   i n   d a t a   s c i e n c e :   
 
 o p e n   t h e   d o o r s   f o r   y o u r   c a r e e r   t h r o u g h   u p g r a d .   e x p e r i e n c e   a   n e w   w a y   o f   l e a r n i n g   o n l i n e   w i t h   d e d i c a t e d   m e n t o r s h i p ,   i n d u s t r y   e x p o s u r e   a n d   e x p e r t   c a r e e r   a s s i s t a n c e .   
 
 u p g r a d   i s   a n   o n l i n e   h i g h e r   e d u c a t i o n   p l a t f o r m   p r o v i d i n g   r i g o r o u s   i n d u s t r y - r e l e v a n t   p r o g r a m s   d e s i g n e d   a n d   d e l i v e r e d   i n   c o l l a b o r a t i o n   w i t h   w o r l d - c l a s s   f a c u l t y   a n d   i n d u s t r y .   m e r g i n g   t h e   l a t e s t   t e c h n o l o g y ,   p e d a g o g y ,   a n d   s e r v i c e s ,   u p g r a d   i s   c r e a t i n g   a n   i m m e r s i v e   l e a r n i n g   e x p e r i e n c e   –   a n y t i m e   a n d   a n y w h e r e .   u p g r a d   b e g a n   i n   2 0 1 5   w i t h   t h e   c o n v i c t i o n   t h a t   i n   a n   e v e r - c h a n g i n g   i n d u s t r y ,   p r o f e s s i o n a l s   n e e d   t o   c o n t i n u o u s l y   u p s k i l l   t h e m s e l v e s   i n   o r d e r   t o   s t a y   r e l e v a n t . 
 
 u p g r a d   h a s   c r e a t e d   s o m e   o f   i n d i a ’ s   l a r g e s t   o n l i n e   p r o g r a m s   t o   h e l p   t h o u s a n d s   o f   p r o f e s s i o n a l s   a c h i e v e   t h e i r   c a r e e r   g o a l s   i n   t h e   a r e a s   o f   d a t a ,   t e c h n o l o g y ,   a n d   m a n a g e m e n t . 
 
 s t a y   o n   t o p   o f   y o u r   i n d u s t r y   b y   i n t e r a c t i n g   w i t h   u s   o n   o u r   s o c i a l   c h a n n e l s : 
 f o l l o w   u s   o n   i n s t a g r a m :   
 l i k e   u s   o n   f a c e b o o k :   
 f o l l o w   u s   o n   t w i t t e r :   
 f o l l o w   u s   o n   l i n k e d i n :           d a t a   s c i e n c e   s k i l l s   |   s k i l l s e t   r e q u i r e d   t o   b e c o m e   a   d a t a   s c i e n t i s t   |   c a r e e r s   i n   s h o r t s   |   u p g r a djoma vlog data science data scientist tinder dating interview cameron ►   w a n t   t o   l a n d   j o b s   a t   f a c e b o o k / g o o g l e / m i c r o s o f t / a m a z o n ?   l e a r n   h o w   t o   d o   t h a t   h e r e : 
 h t t p : / / t e c h i n t e r v i e w p r o . c o m / 
 
 ►   r e s u m e   t e m p l a t e   a n d   c o v e r   l e t t e r   i   u s e d   f o r   a p p l y i n g   t o   s o f t w a r e   i n t e r n s h i p s   a n d   f u l l - t i m e   j o b s : 
 
 
 ►   s i g n   u p   f o r   d a i l y   f a c e b o o k / g o o g l e / m i c r o s o f t / a m a z o n   i n t e r v i e w   q u e s t i o n s   a t : 
 
 
 ►   s i g n   u p   f o r   a l g o e x p e r t   f o r   p r a c t i c i n g   l e e t c o d e : 
   
 u s e   c o d e   "" j o m a ""   f o r   a   3 0 %   d i s c o u n t .   e n d s   s o o n ! 
 
 ►   m y   c o r g i s 
 
 
 ►   s o c i a l   m e d i a 
 
 
 
 
 ►   m y   g e a r 
 l a p t o p   -   
 u l t r a w i d e   m o n i t o r   -   
 m a i n   c a m e r a   -   
 m a i n   l e n s     -   
 w i d e   l e n s   -   
 m i c   i   u s e   -   
 g o r i l l a   p o d   -   
 
 ►   t r a v e l l i n g ?   
 s a v e   $ 5 5   f o r   a i r b n b :   
 s a v e   $ 6   f o r   u b e r :   
 s a v e   $ 5   f o r   l y f t :   
 
 ►   t a k e   a   c o d i n g   q u i z !   s e e   i f   y o u ' r e   q u a l i f i e d   f o r   t o p   t e c h   c o m p a n i e s   a n d   i f   y o u   d o   r e a l l y   w e l l ,   y o u   c a n   s k i p   p h o n e   i n t e r v i e w s :         d a t a   s c i e n t i s t   f r o m   t i n d e r   g i v e s   d a t i n g   a d v i c eapplied data science on coursera learning data science online where to learning data science online data science with python online learn data science with python online data science on coursera best data science courses online applied data science with python coursera university of michigan data science coursera data science daniel bourke mrdbourke 100daysofmlcode 100 days of ml code coursera data science courses coursera data science s p e c i a l   t h a n k s   t o   c o u r s e r a   f o r   o f f e r i n g   t o   s p o n s o r   t h i s   v i d e o .   i   l o v e   j o i n i n g   f o r c e s   w i t h   e p i c   p e o p l e   a n d   c o u r s e r a   h a s   a   w h o l e   t e a m   o f   t h e m ! 
 
 a p p l i e d   d a t a   s c i e n c e   w i t h   p y t h o n   s p e c i a l i z a t i o n   o n   c o u r s e r a   -   
 
 c o n n e c t :   
 w e b   -     
 q u o r a   -   
 m e d i u m   -   
 i n s t a g r a m   -   
 t w i t t e r   -   
 l i n k e d i n   -   
 e m a i l   u p d a t e s   -   
 
 s u p p o r t : 
 p a t r e o n   -   
 
             a p p l i e d   d a t a   s c i e n c e   w i t h   p y t h o n   o n   c o u r s e r a   p r o g r e s s   |   l e a r n i n g   i n t e l l i g e n c e   4 5"
